<?xml version="1.0" encoding="utf-8" standalone="yes"?>
<rootmap
        xmlns="https://example.org/ROOTMAP/SharedAttributesSchema"
        xmlns:xsi="http://www.w3.org/2001/XMLSchema-instance"
        xsi:schemaLocation="https://example.org/ROOTMAP/SharedAttributesSchema https://rootmapstorageaccount.blob.core.windows.net/rootmap-schemata-container/SharedAttributes.xsd">
  <construction>
    <owner>SharedAttributeManager</owner>
    <attribute>
      <owner>Phosphorus</owner>
      <characteristic_descriptor>
        <name>Phosphorus Uptake</name>
        <units>µmol</units>
        <minimum>0.0</minimum>
        <maximum>1000000.0</maximum>
        <default>0.0</default>
        <visible>true</visible>
        <editable>true</editable>
        <tobesaved>true</tobesaved>
        <specialperboxinfo>false</specialperboxinfo>
        <stratum>Soil</stratum>
      </characteristic_descriptor>
      <storage>Scoreboard</storage>
      <variations>Plant,VolumeObject</variations>
    </attribute>
    <attribute>
      <owner>Phosphorus</owner>
      <characteristic_descriptor>
        <name>Cumulative Phosphorus Uptake</name>
        <units>µgP</units>
        <minimum>0.0</minimum>
        <maximum>1000000.0</maximum>
        <default>0.0</default>
        <visible>true</visible>
        <editable>true</editable>
        <tobesaved>true</tobesaved>
        <specialperboxinfo>false</specialperboxinfo>
        <stratum>Soil</stratum>
      </characteristic_descriptor>
      <storage>Phosphorus</storage>
      <variations>Plant</variations>
    </attribute>
    <attribute>
      <owner>Phosphorus</owner>
      <characteristic_descriptor>
        <name>Cumulative Fertiliser P Uptake</name>
        <units>µgP</units>
        <minimum>0.0</minimum>
        <maximum>1000000.0</maximum>
        <default>0.0</default>
        <visible>true</visible>
        <editable>true</editable>
        <tobesaved>true</tobesaved>
        <specialperboxinfo>false</specialperboxinfo>
        <stratum>Soil</stratum>
      </characteristic_descriptor>
      <storage>Phosphorus</storage>
      <variations>Plant</variations>
    </attribute>
    <attribute>
      <owner>Phosphorus</owner>
      <characteristic_descriptor>
        <name>Cumul Local Phosphorus Uptake</name>
        <units>µgP</units>
        <minimum>0.0</minimum>
        <maximum>1000.0</maximum>
        <default>0.0</default>
        <visible>true</visible>
        <editable>true</editable>
        <tobesaved>true</tobesaved>
        <specialperboxinfo>false</specialperboxinfo>
        <stratum>Soil</stratum>
      </characteristic_descriptor>
      <storage>Scoreboard</storage>
      <variations>Plant,VolumeObject</variations>
    </attribute>
    <attribute>
      <owner>Phosphorus</owner>
      <characteristic_descriptor>
        <name>P Absorption Power</name>
        <units>cm/s</units>
        <minimum>0.0</minimum>
        <maximum>1e-3</maximum>
        <default>4e-4</default>
        <visible>true</visible>
        <editable>true</editable>
        <tobesaved>true</tobesaved>
        <specialperboxinfo>false</specialperboxinfo>
        <stratum>Soil</stratum>
      </characteristic_descriptor>
      <storage>Scoreboard</storage>
      <variations>Plant,VolumeObject</variations>
    </attribute>
    <attribute>
      <owner>Phosphorus</owner>
      <characteristic_descriptor>
        <name>Organic P Mineralisation</name>
        <units>none</units>
        <minimum>0</minimum>
        <maximum>1</maximum>
        <default>0</default>
        <visible>false</visible>
        <editable>false</editable>
        <tobesaved>false</tobesaved>
        <specialperboxinfo>false</specialperboxinfo>
        <stratum>Soil</stratum>
      </characteristic_descriptor>
      <storage>Phosphorus</storage>
      <variations>Plant</variations>
    </attribute>
    <attribute>
      <owner>Phosphorus</owner>
      <characteristic_descriptor>
        <name>Org P Min Fraction</name>
        <units>none</units>
        <minimum>0</minimum>
        <maximum>1</maximum>
        <default>0.003</default>
        <visible>false</visible>
        <editable>false</editable>
        <tobesaved>false</tobesaved>
        <specialperboxinfo>false</specialperboxinfo>
        <stratum>Soil</stratum>
      </characteristic_descriptor>
      <storage>Phosphorus</storage>
      <variations>Plant</variations>
    </attribute>
    <attribute>
      <owner>Phosphorus</owner>
      <characteristic_descriptor>
        <name>Org P Min Time</name>
        <units>months</units>
        <minimum>1</minimum>
        <maximum>12</maximum>
        <default>10</default>
        <visible>false</visible>
        <editable>false</editable>
        <tobesaved>false</tobesaved>
        <specialperboxinfo>false</specialperboxinfo>
        <stratum>Soil</stratum>
      </characteristic_descriptor>
      <storage>Phosphorus</storage>
      <variations>Plant</variations>
    </attribute>
    <attribute>
      <owner>Phosphorus</owner>
      <characteristic_descriptor>
        <name>P Utilisation Efficiency</name>
        <units>unitless</units>
        <minimum>0.0</minimum>
        <maximum>10.0</maximum>
        <default>1.0</default>
        <visible>false</visible>
        <editable>false</editable>
        <tobesaved>false</tobesaved>
        <specialperboxinfo>false</specialperboxinfo>
        <stratum>Soil</stratum>
      </characteristic_descriptor>
      <storage>Phosphorus</storage>
      <variations>Plant</variations>
    </attribute>
    <attribute>
      <owner>Phosphorus</owner>
      <characteristic_descriptor>
        <name>P Flux Max</name>
        <units>umols/cm.s</units>
        <minimum>0.0</minimum>
        <maximum>0.01</maximum>
        <default>0.9e-8</default>
        <visible>false</visible>
        <editable>false</editable>
        <tobesaved>false</tobesaved>
        <specialperboxinfo>false</specialperboxinfo>
        <stratum>Soil</stratum>
      </characteristic_descriptor>
      <storage>Phosphorus</storage>
      <variations>Plant</variations>
    </attribute>
    <attribute>
      <owner>Phosphorus</owner>
      <characteristic_descriptor>
        <name>P Uptake Kinetic Const</name>
        <units>umols/cm3</units>
        <minimum>0.0</minimum>
        <maximum>1.0</maximum>
        <default>0.0055</default>
        <visible>false</visible>
        <editable>false</editable>
        <tobesaved>false</tobesaved>
        <specialperboxinfo>false</specialperboxinfo>
        <stratum>Soil</stratum>
      </characteristic_descriptor>
      <storage>Phosphorus</storage>
      <variations>Plant</variations>
    </attribute>
    <attribute>
      <owner>Phosphorus</owner>
      <characteristic_descriptor>
        <name>P Conc Min</name>
        <units>umols/cm3</units>
        <minimum>0.0</minimum>
        <maximum>0.1</maximum>
        <default>0.0002</default>
        <visible>false</visible>
        <editable>false</editable>
        <tobesaved>false</tobesaved>
        <specialperboxinfo>false</specialperboxinfo>
        <stratum>Soil</stratum>
      </characteristic_descriptor>
      <storage>Phosphorus</storage>
      <variations>Plant</variations>
    </attribute>
    <attribute>
      <owner>Phosphorus</owner>
      <characteristic_descriptor>
        <minimum>0.0</minimum>
        <maximum>5.0</maximum>
        <default>1.0</default>
        <name>Apase Multiplier</name>
        <units>none</units>
        <visible>false</visible>
        <editable>false</editable>
        <tobesaved>false</tobesaved>
        <specialperboxinfo>false</specialperboxinfo>
        <stratum>Soil</stratum>
      </characteristic_descriptor>
      <storage>Phosphorus</storage>
      <variations></variations>
    </attribute>
  </construction>
</rootmap>
