<?xml version="1.0" encoding="utf-8" standalone="yes"?>

<rootmap
        xmlns="https://example.org/ROOTMAP/SharedAttributesSchema"
        xmlns:xsi="http://www.w3.org/2001/XMLSchema-instance"
        xsi:schemaLocation="https://example.org/ROOTMAP/SharedAttributesSchema https://rootmapstorageaccount.blob.core.windows.net/rootmap-schemata-container/SharedAttributes.xsd">
	<construction>
	<owner>SharedAttributeManager</owner>

    <attribute>
      <owner>Nitrate</owner>
      <characteristic_descriptor>
        <name>Plant Nitrate Uptake</name>
        <units>µmols</units>
        <minimum>0.0</minimum>
        <maximum>INF</maximum>
        <default>0.0</default>
        <visible>true</visible>
        <editable>false</editable>
        <tobesaved>false</tobesaved>
        <specialperboxinfo>false</specialperboxinfo>
        <stratum>Soil</stratum>
      </characteristic_descriptor>
      <storage>Scoreboard</storage>
      <variations>Plant,VolumeObject</variations>
    </attribute>
    <attribute>
      <owner>Nitrate</owner>
      <characteristic_descriptor>
        <name>Cumul Plant N Fixation</name>
        <units>µmols</units>
        <minimum>0.0</minimum>
        <maximum>INF</maximum>
        <default>0.0</default>
        <visible>true</visible>
        <editable>false</editable>
        <tobesaved>false</tobesaved>
        <specialperboxinfo>false</specialperboxinfo>
        <stratum>Soil</stratum>
      </characteristic_descriptor>
      <storage>Nitrate</storage>
      <variations>Plant</variations>
    </attribute>
	  <attribute>
		  <owner>Nitrate</owner>
		  <characteristic_descriptor>
			  <name>Cumul Plant Nitrate Uptake</name>
			  <units>µgN</units>
			  <minimum>0.0</minimum>
			  <maximum>INF</maximum>
			  <default>0.0</default>
			  <visible>true</visible>
			  <editable>false</editable>
			  <tobesaved>false</tobesaved>
			  <specialperboxinfo>false</specialperboxinfo>
			  <stratum>Soil</stratum>
		  </characteristic_descriptor>
		  <storage>Nitrate</storage>
		  <variations>Plant</variations>
	  </attribute>
	  <attribute>
		  <owner>Nitrate</owner>
		  <characteristic_descriptor>
			  <name>Cumul Plant FertN Uptake</name>
			  <units>µgN</units>
			  <minimum>0.0</minimum>
			  <maximum>INF</maximum>
			  <default>0.0</default>
			  <visible>true</visible>
			  <editable>false</editable>
			  <tobesaved>false</tobesaved>
			  <specialperboxinfo>false</specialperboxinfo>
			  <stratum>Soil</stratum>
		  </characteristic_descriptor>
		  <storage>Nitrate</storage>
		  <variations>Plant</variations>
	  </attribute>
    <attribute>
      <owner>Nitrate</owner>
      <characteristic_descriptor>
        <name>Cumul RO Nitrate Uptake</name>
        <units>µgN</units>
        <minimum>0.0</minimum>
        <maximum>INF</maximum>
        <default>0.0</default>
        <visible>true</visible>
        <editable>false</editable>
        <tobesaved>false</tobesaved>
        <specialperboxinfo>false</specialperboxinfo>
        <stratum>Soil</stratum>
      </characteristic_descriptor>
      <storage>Nitrate</storage>
      <variations>Plant,RootOrder,VolumeObject</variations>
    </attribute>
    <attribute>
      <owner>Nitrate</owner>
      <characteristic_descriptor>
        <name>Cumul Local Nitrate Uptake</name>
        <units>µgN</units>
        <minimum>0.0</minimum>
        <maximum>INF</maximum>
        <default>0.0</default>
        <visible>true</visible>
        <editable>false</editable>
        <tobesaved>false</tobesaved>
        <specialperboxinfo>false</specialperboxinfo>
        <stratum>Soil</stratum>
      </characteristic_descriptor>
      <storage>Scoreboard</storage>
	  <variations>Plant,VolumeObject</variations>
    </attribute>
	  <attribute>
		  <owner>Nitrate</owner>
		  <characteristic_descriptor>
			  <name>Cumul Local FertN Uptake</name>
			  <units>µgN</units>
			  <minimum>0.0</minimum>
			  <maximum>INF</maximum>
			  <default>0.0</default>
			  <visible>true</visible>
			  <editable>false</editable>
			  <tobesaved>false</tobesaved>
			  <specialperboxinfo>false</specialperboxinfo>
			  <stratum>Soil</stratum>
		  </characteristic_descriptor>
		  <storage>Scoreboard</storage>
		  <variations>Plant,VolumeObject</variations>
	  </attribute>
	  <attribute>
		  <owner>Nitrate</owner>
		  <characteristic_descriptor>
			  <name>Added Fertiliser N</name>
        <!-- days after sowing that the 2nd N fertiliser application is made -->
			  <units>days</units>
			  <minimum>0.0</minimum>
			  <maximum>360</maximum>
			  <default>0.0</default>
			  <visible>true</visible>
			  <editable>false</editable>
			  <tobesaved>false</tobesaved>
			  <specialperboxinfo>false</specialperboxinfo>
			  <stratum>Soil</stratum>
		  </characteristic_descriptor>
		  <storage>Nitrate</storage>
		  <variations>Plant</variations>
	  </attribute>
	  <attribute>
		  <owner>Nitrate</owner>
		  <characteristic_descriptor>
			  <name>N Absorption Power</name>
			  <units>cm/s</units>
			  <minimum>1e-9</minimum>
			  <maximum>1e-3</maximum>
			  <default>2e-7</default>
			  <visible>true</visible>
			  <editable>false</editable>
			  <tobesaved>false</tobesaved>
			  <specialperboxinfo>false</specialperboxinfo>
			  <stratum>Soil</stratum>
		  </characteristic_descriptor>
		  <storage>Nitrate</storage>
		  <variations>Plant,VolumeObject</variations>
	  </attribute>
    <attribute>
      <owner>Nitrate</owner>
      <characteristic_descriptor>
        <name>N Flux Max</name>
        <units>umol/cm.s</units>
        <minimum>0.0</minimum>
        <maximum>0.01</maximum>
        <default>9.5e-7</default>
        <visible>false</visible>
        <editable>false</editable>
        <tobesaved>false</tobesaved>
        <specialperboxinfo>false</specialperboxinfo>
        <stratum>Soil</stratum>
      </characteristic_descriptor>
      <storage>Nitrate</storage>
      <variations>Plant</variations>
    </attribute>
    <attribute>
      <owner>Nitrate</owner>
      <characteristic_descriptor>
        <name>N Uptake Kinetic Const</name>
        <units>umol/cm3</units>
        <minimum>0.0</minimum>
        <maximum>1.0</maximum>
        <default>0.01188</default>
        <visible>false</visible>
        <editable>false</editable>
        <tobesaved>false</tobesaved>
        <specialperboxinfo>false</specialperboxinfo>
        <stratum>Soil</stratum>
      </characteristic_descriptor>
      <storage>Nitrate</storage>
      <variations>Plant</variations>
    </attribute>
    		<attribute>
			<owner>Nitrate</owner>
			<characteristic_descriptor>
				<name>Degree Days</name>
				<units>&#xB0;&#xB0;</units>
				<minimum>0.0</minimum>
				<maximum>1.0e10</maximum>
				<default>0.0</default>
				<visible>true</visible>
				<editable>true</editable>
				<tobesaved>true</tobesaved>
				<specialperboxinfo>false</specialperboxinfo>
				<stratum>Soil</stratum>
			</characteristic_descriptor>
			<storage>Nitrate</storage>
			<variations></variations>
		</attribute>
		<attribute>
			<owner>Nitrate</owner>
			<characteristic_descriptor>
				<name>Degree Days at Growth Start</name>
				<units>&#xB0;days</units>
				<minimum>0.0</minimum>
				<maximum>1.0e10</maximum>
				<default>0.0</default>
				<visible>true</visible>
				<editable>true</editable>
				<tobesaved>true</tobesaved>
				<specialperboxinfo>false</specialperboxinfo>
				<stratum>Soil</stratum>
			</characteristic_descriptor>
			<storage>Nitrate</storage>
			<variations></variations>
		</attribute>
		<attribute>
			<owner>Nitrate</owner>
			<characteristic_descriptor>
				<minimum>0</minimum>
				<maximum>100</maximum>
				<default>10.0</default>
				<name>Mineralisation Depth</name>
				<units>cm</units>
				<visible>true</visible>
				<editable>true</editable>
				<tobesaved>true</tobesaved>
				<specialperboxinfo>false</specialperboxinfo>
				<stratum>Soil</stratum>
			</characteristic_descriptor>
			<storage>Nitrate</storage>
			<variations></variations>
		</attribute>
    <attribute>
      <owner>Nitrate</owner>
      <characteristic_descriptor>
        <minimum>0</minimum>
        <maximum>100</maximum>
        <default>0.0</default>
        <name>Calculate Nitrate Mineralisation</name>
        <units>none</units>
        <visible>false</visible>
        <editable>false</editable>
        <tobesaved>true</tobesaved>
        <specialperboxinfo>false</specialperboxinfo>
        <stratum>Soil</stratum>
      </characteristic_descriptor>
      <storage>Nitrate</storage>
      <variations></variations>
    </attribute>
  </construction>
</rootmap>
