<?xml version="1.0" encoding="utf-8" standalone="yes"?>
<rootmap
        xmlns="https://example.org/ROOTMAP/SharedAttributesSchema"
        xmlns:xsi="http://www.w3.org/2001/XMLSchema-instance"
        xsi:schemaLocation="https://example.org/ROOTMAP/SharedAttributesSchema https://rootmapstorageaccount.blob.core.windows.net/rootmap-schemata-container/SharedAttributes.xsd">
  <construction>
    <owner>SharedAttributeManager</owner>
    <attribute>
      <owner>Water</owner>
      <characteristic_descriptor>
        <name>Water Flux</name>
        <units>cm^3/cm s</units>
        <minimum>0.0</minimum>
        <maximum>1000.0</maximum>
        <default>0.0</default>
        <visible>true</visible>
        <editable>true</editable>
        <tobesaved>true</tobesaved>
        <specialperboxinfo>false</specialperboxinfo>
        <stratum>Soil</stratum>
      </characteristic_descriptor>
      <storage>Scoreboard</storage>
            <variations>Plant,RootOrder,VolumeObject</variations>
    </attribute>
    <attribute>
      <owner>Water</owner>
      <characteristic_descriptor>
        <name>Cumul Local Plant Water Uptake</name>
        <units>cm^3</units>
        <minimum>0.0</minimum>
        <maximum>1000.0</maximum>
        <default>0.0</default>
        <visible>true</visible>
        <editable>true</editable>
        <tobesaved>true</tobesaved>
        <specialperboxinfo>false</specialperboxinfo>
        <stratum>Soil</stratum>
      </characteristic_descriptor>
      <storage>Scoreboard</storage>
            <variations>Plant,VolumeObject</variations>
    </attribute>
	<attribute>
	  <owner>Water</owner>
	  <characteristic_descriptor>
		<name>Water Upregulation Limit</name>
		<units>[None]</units>
		<minimum>1.0</minimum>
		<maximum>3.0</maximum>
		<default>1.2</default>
		<visible>false</visible>
		<editable>false</editable>
		<tobesaved>true</tobesaved>
		<specialperboxinfo>false</specialperboxinfo>
		<stratum>Soil</stratum>
	  </characteristic_descriptor>
	  <storage>Water</storage>
	  <variations>Plant</variations>
	</attribute>
	<attribute>
	  <owner>Water</owner>
	  <characteristic_descriptor>
		<name>Cumul Total Plant Water Uptake</name>
	    <units>cm^3</units>
		<minimum>0.0</minimum>
		<maximum>1.0e10</maximum>
		<default>0.0</default>
		<visible>true</visible>
		<editable>true</editable>
		<tobesaved>true</tobesaved>
		<specialperboxinfo>false</specialperboxinfo>
		<stratum>Soil</stratum>
	  </characteristic_descriptor>
	  <storage>Water</storage>
	  <variations>Plant</variations>
	  </attribute>
	  <attribute>
		  <owner>Water</owner>
		  <characteristic_descriptor>
			  <name>Local Plant Water Uptake</name>
			  <units>cm^3</units>
			  <minimum>0.0</minimum>
			  <maximum>1.0e10</maximum>
			  <default>0.0</default>
			  <visible>true</visible>
			  <editable>true</editable>
			  <tobesaved>true</tobesaved>
			  <specialperboxinfo>false</specialperboxinfo>
			  <stratum>Soil</stratum>
		  </characteristic_descriptor>
		  <storage>Scoreboard</storage>
            <variations>Plant,VolumeObject</variations>
	  </attribute>	  
	  <attribute>
		  <owner>Water</owner>
		  <characteristic_descriptor>
			  <name>Rain Amount</name>
			  <units>cm</units>
			  <minimum>0.0</minimum>
			  <maximum>1.0e10</maximum>
			  <default>0.0</default>
			  <visible>true</visible>
			  <editable>true</editable>
			  <tobesaved>true</tobesaved>
			  <specialperboxinfo>false</specialperboxinfo>
			  <stratum>Soil</stratum>
		  </characteristic_descriptor>
		  <storage>Water</storage>
            <variations/>
	  </attribute>
	  <attribute>
		  <owner>Water</owner>
		  <characteristic_descriptor>
			  <name>Pan Evaporation</name>
			  <units>mm</units>
			  <minimum>0.0</minimum>
			  <maximum>1.0e10</maximum>
			  <default>0.0</default>
			  <visible>true</visible>
			  <editable>true</editable>
			  <tobesaved>true</tobesaved>
			  <specialperboxinfo>false</specialperboxinfo>
			  <stratum>Soil</stratum>
		  </characteristic_descriptor>
		  <storage>Water</storage>
            <variations/>
	  </attribute>
	  <attribute>
		  <owner>Water</owner>
		  <characteristic_descriptor>
			  <name>Max Temperature</name>
			  <units>&#xB0;</units>
			  <minimum>0.0</minimum>
			  <maximum>1.0e10</maximum>
			  <default>0.0</default>
			  <visible>true</visible>
			  <editable>true</editable>
			  <tobesaved>true</tobesaved>
			  <specialperboxinfo>false</specialperboxinfo>
			  <stratum>Soil</stratum>
		  </characteristic_descriptor>
		  <storage>Water</storage>
            <variations/>
	  </attribute>	  
	  <attribute>
		  <owner>Water</owner>
		  <characteristic_descriptor>
			  <name>Min Temperature</name>
			  <units>&#xB0;</units>
			  <minimum>0.0</minimum>
			  <maximum>1.0e10</maximum>
			  <default>0.0</default>
			  <visible>true</visible>
			  <editable>true</editable>
			  <tobesaved>true</tobesaved>
			  <specialperboxinfo>false</specialperboxinfo>
			  <stratum>Soil</stratum>
		  </characteristic_descriptor>
		  <storage>Water</storage>
            <variations/>
	  </attribute>
	  <attribute>
		  <owner>Water</owner>
		  <characteristic_descriptor>
			  <name>Radiation</name>
			  <units>MJm^-2</units>
			  <minimum>0.0</minimum>
			  <maximum>1.0e10</maximum>
			  <default>0.0</default>
			  <visible>true</visible>
			  <editable>true</editable>
			  <tobesaved>true</tobesaved>
			  <specialperboxinfo>false</specialperboxinfo>
			  <stratum>Soil</stratum>
		  </characteristic_descriptor>
		  <storage>Water</storage>
            <variations/>
	  </attribute>
	  <attribute>
		  <owner>Water</owner>
		  <characteristic_descriptor>
			  <name>Green Cover</name>
			  <units>NONE</units>
			  <minimum>0.0</minimum>
			  <maximum>1.0</maximum>
			  <default>0.0</default>
			  <visible>true</visible>
			  <editable>true</editable>
			  <tobesaved>true</tobesaved>
			  <specialperboxinfo>false</specialperboxinfo>
			  <stratum>Soil</stratum>
		  </characteristic_descriptor>
		  <storage>Water</storage>
            <variations/>
	  </attribute>
    <attribute>
      <owner>Water</owner>
      <characteristic_descriptor>
        <name>Avg Green Cover Factor</name>
        <units>NONE</units>
        <minimum>0.0</minimum>
        <maximum>1.0</maximum>
        <default>0.0</default>
        <visible>true</visible>
        <editable>true</editable>
        <tobesaved>true</tobesaved>
        <specialperboxinfo>false</specialperboxinfo>
        <stratum>Soil</stratum>
      </characteristic_descriptor>
      <storage>Water</storage>
            <variations/>
    </attribute>
	  <attribute>
		  <owner>Water</owner>
		  <characteristic_descriptor>
			  <name>Residue Cover</name>
			  <units>NONE</units>
			  <minimum>0.0</minimum>
			  <maximum>1.0</maximum>
			  <default>0.1</default>
			  <visible>true</visible>
			  <editable>true</editable>
			  <tobesaved>true</tobesaved>
			  <specialperboxinfo>false</specialperboxinfo>
			  <stratum>Soil</stratum>
		  </characteristic_descriptor>
		  <storage>Water</storage>
            <variations/>
	  </attribute>
	  <attribute>
		  <owner>Water</owner>
		  <characteristic_descriptor>
			  <name>Cumulative Evaporation Before Germination</name>
			  <units>mm</units>
			  <minimum>0.0</minimum>
			  <maximum>1.0e10</maximum>
			  <default>0.0</default>
			  <visible>true</visible>
			  <editable>true</editable>
			  <tobesaved>true</tobesaved>
			  <specialperboxinfo>false</specialperboxinfo>
			  <stratum>Soil</stratum>
		  </characteristic_descriptor>
		  <storage>Water</storage>
            <variations/>
	  </attribute>
	  <attribute>
		  <owner>Water</owner>
		  <characteristic_descriptor>
			  <name>Cumulative Evaporation After Germination</name>
			  <units>mm</units>
			  <minimum>0.0</minimum>
			  <maximum>1.0e10</maximum>
			  <default>0.0</default>
			  <visible>true</visible>
			  <editable>true</editable>
			  <tobesaved>true</tobesaved>
			  <specialperboxinfo>false</specialperboxinfo>
			  <stratum>Soil</stratum>
		  </characteristic_descriptor>
		  <storage>Water</storage>
            <variations/>
	  </attribute>
    <attribute>
      <owner>Water</owner>
      <characteristic_descriptor>
        <!-- Tell the water routine whether to calculate evaporation or not 0 = don't calculate; 1 = do calculate -->
        <name>Calculate Evaporation</name>
        <units>unitless</units>
        <minimum>0.0</minimum>
        <maximum>1.0</maximum>
        <default>0.0</default>
        <visible>false</visible>
        <editable>true</editable>
        <tobesaved>true</tobesaved>
        <specialperboxinfo>false</specialperboxinfo>
        <stratum>Soil</stratum>
      </characteristic_descriptor>
      <storage>Water</storage>
            <variations/>
    </attribute>
	  
  </construction>
</rootmap>
