<?xml version="1.0" encoding="utf-8" standalone="yes"?>

<rootmap
        xmlns="https://example.org/ROOTMAP/SharedAttributesSchema"
        xmlns:xsi="http://www.w3.org/2001/XMLSchema-instance"
        xsi:schemaLocation="https://example.org/ROOTMAP/SharedAttributesSchema https://rootmapstorageaccount.blob.core.windows.net/rootmap-schemata-container/SharedAttributes.xsd">
  <construction>
    <owner>SharedAttributeManager</owner>
    <attribute>
      <owner>PlantCoordinator</owner>
      <characteristic_descriptor>
        <name>Branch Lag Time</name>
        <units>hours</units>
        <minimum>0.0</minimum>
        <maximum>infinity</maximum>
        <default>150.0</default>
        <visible>true</visible>
        <editable>true</editable>
        <tobesaved>true</tobesaved>
        <stratum>Soil</stratum>
      </characteristic_descriptor>
      <storage>Scoreboard</storage>
      <variations>RootOrder</variations>
      <defaults>
        <variation_name>RootOrder</variation_name>
        <defaults>96.0,96.0,360.0,480.0</defaults>
      </defaults>
    </attribute>
    <attribute>
      <owner>PlantCoordinator</owner>
      <characteristic_descriptor>
        <name>Deflection Index</name>
        <units>-</units>
        <minimum>0.0</minimum>
        <maximum>1.0</maximum>
        <default>0.3</default>
        <visible>true</visible>
        <editable>true</editable>
        <tobesaved>true</tobesaved>
        <stratum>Soil</stratum>
      </characteristic_descriptor>
      <storage>Scoreboard</storage>
      <variations>RootOrder</variations>
      <defaults>
        <variation_name>RootOrder</variation_name>
        <defaults>0.3,0.25,0.25,0.25</defaults>
      </defaults>
    </attribute>
    <attribute>
      <owner>PlantCoordinator</owner>
      <characteristic_descriptor>
        <name>Final Branch Interval</name>
        <units>cm</units>
        <minimum>0.0</minimum>
        <maximum>10.0</maximum>
        <default>2.0</default>
        <visible>true</visible>
        <editable>true</editable>
        <tobesaved>true</tobesaved>
        <stratum>Soil</stratum>
      </characteristic_descriptor>
      <storage>Scoreboard</storage>
      <variations>RootOrder</variations>
      <defaults>
        <variation_name>RootOrder</variation_name>
        <defaults>0.5,0.6,0.5,0.4</defaults>
      </defaults>
    </attribute>
    <attribute>
      <owner>PlantCoordinator</owner>
      <characteristic_descriptor>
        <name>Geotropism Index</name>
        <units>-</units>
        <minimum>0.0</minimum>
        <maximum>1.0</maximum>
        <default>0.8</default>
        <visible>true</visible>
        <editable>true</editable>
        <tobesaved>true</tobesaved>
        <stratum>Soil</stratum>
      </characteristic_descriptor>
      <storage>Scoreboard</storage>
      <variations>RootOrder</variations>
      <defaults>
        <variation_name>RootOrder</variation_name>
        <defaults>0.8,0.15,0.0,0.0</defaults>
      </defaults>
    </attribute>
    <attribute>
      <owner>PlantCoordinator</owner>
      <characteristic_descriptor>
        <name>Growth Rate Max</name>
        <units>cm/hour</units>
        <minimum>0.0</minimum>
        <maximum>10.0</maximum>
        <default>0.5</default>
        <visible>true</visible>
        <editable>true</editable>
        <tobesaved>true</tobesaved>
        <stratum>Soil</stratum>
      </characteristic_descriptor>
      <storage>Scoreboard</storage>
      <variations>Plant,RootOrder</variations>
      <defaults>
        <variation_name>RootOrder</variation_name>
        <defaults>0.4,0.4,0.4,0.4</defaults>
      </defaults>
    </attribute>
    <attribute>
      <owner>PlantCoordinator</owner>
      <characteristic_descriptor>
        <name>Initial Branch Angle</name>
        <units>&#xB0;</units>
        <minimum>0.0</minimum>
        <maximum>180.0</maximum>
        <default>90.0</default>
        <visible>true</visible>
        <editable>true</editable>
        <tobesaved>true</tobesaved>
        <stratum>Soil</stratum>
      </characteristic_descriptor>
      <storage>Scoreboard</storage>
      <variations>RootOrder</variations>
    </attribute>
    <attribute>
      <owner>PlantCoordinator</owner>
      <characteristic_descriptor>
        <name>Initial Branch Interval</name>
        <units>cm</units>
        <minimum>0.0</minimum>
        <maximum>100.0</maximum>
        <default>0.0</default>
        <visible>true</visible>
        <editable>true</editable>
        <tobesaved>true</tobesaved>
        <stratum>Soil</stratum>
      </characteristic_descriptor>
      <storage>Scoreboard</storage>
      <variations>RootOrder</variations>
    </attribute>
    <attribute>
      <owner>PlantCoordinator</owner>
      <characteristic_descriptor>
        <name>Root Conductance</name>
        <units>-</units>
        <minimum>0.0</minimum>
        <maximum>1.0</maximum>
        <default>1.0</default>
        <visible>true</visible>
        <editable>true</editable>
        <tobesaved>true</tobesaved>
        <stratum>Soil</stratum>
      </characteristic_descriptor>
      <storage>Scoreboard</storage>
      <variations>RootOrder</variations>
    </attribute>
    <attribute>
      <owner>PlantCoordinator</owner>
      <characteristic_descriptor>
        <name>Tip Growth Duration</name>
        <units>hours</units>
        <minimum>0.0</minimum>
        <maximum>infinity</maximum>
        <default>6000.0</default>
        <visible>true</visible>
        <editable>true</editable>
        <tobesaved>true</tobesaved>
        <stratum>Soil</stratum>
      </characteristic_descriptor>
      <storage>Scoreboard</storage>
      <variations>RootOrder</variations>
      <defaults>
        <variation_name>RootOrder</variation_name>
        <defaults>6000,3120,1920,1776</defaults>
      </defaults>
    </attribute>
    <attribute>
      <owner>PlantCoordinator</owner>
      <characteristic_descriptor>
        <name>Initial Seminal Deflection</name>
        <units>&#xB0;</units>
        <minimum>0.0</minimum>
        <maximum>90.0</maximum>
        <default>0.0</default>
        <visible>true</visible>
        <editable>true</editable>
        <tobesaved>true</tobesaved>
        <stratum>Soil</stratum>
      </characteristic_descriptor>
      <storage>PlantCoordinator</storage>
      <variations>PlantType</variations>
    </attribute>
    <attribute>
      <owner>PlantCoordinator</owner>
      <characteristic_descriptor>
        <name>Germination Lag</name>
        <units>hours</units>
        <minimum>0.0</minimum>
        <maximum>infinity</maximum>
        <default>27.0</default>
        <visible>true</visible>
        <editable>true</editable>
        <tobesaved>true</tobesaved>
        <stratum>Soil</stratum>
      </characteristic_descriptor>
      <storage>PlantCoordinator</storage>
      <variations>PlantType</variations>
    </attribute>
    <attribute>
      <owner>PlantCoordinator</owner>
      <characteristic_descriptor>
        <name>First Seminal Probability</name>
        <units>-</units>
        <minimum>0.0</minimum>
        <maximum>1.0</maximum>
        <default>1.0</default>
        <visible>true</visible>
        <editable>true</editable>
        <tobesaved>true</tobesaved>
        <stratum>Soil</stratum>
      </characteristic_descriptor>
      <storage>PlantCoordinator</storage>
      <variations>PlantType</variations>
    </attribute>
    <attribute>
      <owner>PlantCoordinator</owner>
      <characteristic_descriptor>
        <name>Temperature of Zero Growth</name>
        <units>&#xB0;</units>
        <minimum>-infinity</minimum>
        <maximum>infinity</maximum>
        <default>0.0</default>
        <visible>true</visible>
        <editable>true</editable>
        <tobesaved>true</tobesaved>
        <stratum>Soil</stratum>
      </characteristic_descriptor>
      <storage>PlantCoordinator</storage>
      <variations>PlantType</variations>
    </attribute>
    <attribute>
      <owner>PlantCoordinator</owner>
      <characteristic_descriptor>
        <name>Root Radius</name>
        <units>mm</units>
        <minimum>0.01</minimum>
        <maximum>5.0</maximum>
        <default>1.0</default>
        <visible>true</visible>
        <editable>true</editable>
        <tobesaved>true</tobesaved>
        <stratum>Soil</stratum>
      </characteristic_descriptor>
      <storage>PlantCoordinator</storage>
      <variations>Plant,RootOrder</variations>
    </attribute>
      <attribute>
        <owner>PlantCoordinator</owner>
        <characteristic_descriptor>
          <name>Organic Exudate</name>
          <units>none</units>
          <!-- none = 0, lecithin = 1, citrate = 2, malate = 3 -->
          <minimum>0</minimum>
          <maximum>3</maximum>
          <default>1</default>
          <visible>true</visible>
          <editable>true</editable>
          <tobesaved>true</tobesaved>
          <stratum>Soil</stratum>
        </characteristic_descriptor>
        <storage>PlantCoordinator</storage>
        <variations>Plant</variations>
      </attribute>
  </construction>
</rootmap>
